{
  "ok": true,
  "code": "OK",
  "ms": 2.0,
  "result": {
    "ok": true,
    "status": "ok",
    "reason": "All graph subsystems healthy",
    "server": "graph-adapter-1",
    "version": "1.2.3"
  },
  "protocol": "graph/v1.0",
  "component": "graph",
  "schema_version": "1.0.0",
  "request_id": "req_graph_health_001"
}
