{
  "ok": true,
  "code": "OK",
  "ms": 12.7,
  "result": {
    "rows": [
      {
        "id": "user:123",
        "label": "User",
        "name": "Alice",
        "friend_count": 3
      },
      {
        "id": "user:456",
        "label": "User",
        "name": "Bob",
        "friend_count": 1
      }
    ],
    "next_page_token": null,
    "warnings": [
      {
        "code": "GRAPH_PAGE_SIZE_ADJUSTED",
        "message": "Page size was reduced by the server."
      }
    ]
  },
  "protocol": "graph/v1.0",
  "component": "graph",
  "schema_version": "1.0.0",
  "request_id": "req_graph_query_001"
}
