{
  "ok": true,
  "code": "OK",
  "ms": 4.6,
  "result": {
    "protocol": "graph/v1.0",
    "server": "graph-adapter-1",
    "version": "1.2.3",
    "features": {
      "dialects": ["cypher", "gql"],
      "supports_txn": true,
      "supports_schema_ops": true,
      "supports_streaming": true,
      "supports_deadline": true
    },
    "limits": {
      "max_batch_ops": 5000,
      "concurrency": 64,
      "max_query_length": 100000
    },
    "cache": {
      "supports_tags": true,
      "max_ttl_ms": 600000,
      "invalidation_webhook": true
    },
    "extensions": {
      "vendor:graph_impl": "neo4j"
    }
  },
  "protocol": "graph/v1.0",
  "component": "graph",
  "schema_version": "1.0.0",
  "request_id": "req_graph_capabilities_001"
}
