{
  "ok": true,
  "code": "OK",
  "ms": 7.9,
  "result": {
    "id": "edge:user:123->user:456",
    "entity": {
      "kind": "edge",
      "id": "edge:user:123->user:456",
      "label": "FRIEND",
      "props": {
        "since": "2021-01-01"
      },
      "from_id": "user:123",
      "to_id": "user:456"
    }
  },
  "protocol": "graph/v1.0",
  "component": "graph",
  "schema_version": "1.0.0",
  "request_id": "req_graph_edge_create_001"
}
