{
  "ok": true,
  "code": "OK",
  "ms": 8.3,
  "result": {
    "id": "user:123",
    "entity": {
      "kind": "vertex",
      "id": "user:123",
      "label": "User",
      "props": {
        "name": "Alice",
        "active": true
      }
    }
  },
  "protocol": "graph/v1.0",
  "component": "graph",
  "schema_version": "1.0.0",
  "request_id": "req_graph_upsert_nodes_001"
}
